{
  "$schema": "https://json-schema.org/draft/2020-12/schema",
  "$id": "urn:mib:0.1:schema:same-model-experiment",
  "title": "MIB Same-Model Empirical Experiment",
  "type": "object",
  "additionalProperties": false,
  "required": [
    "mib",
    "kind",
    "id",
    "pack",
    "scenario_schema",
    "profile",
    "model",
    "agent",
    "calibration"
  ],
  "properties": {
    "mib": {
      "enum": [
        "0.1",
        "0.2"
      ]
    },
    "kind": {
      "const": "MIBSameModelExperiment"
    },
    "id": {
      "type": "string",
      "minLength": 1
    },
    "pack": {
      "type": "string",
      "minLength": 1
    },
    "scenario_schema": {
      "type": "string",
      "minLength": 1
    },
    "profile": {
      "type": "string",
      "minLength": 1
    },
    "model": {
      "type": "object",
      "additionalProperties": true,
      "required": [
        "client",
        "model_id",
        "parameters"
      ],
      "properties": {
        "client": {
          "enum": [
            "http_json",
            "openai_compatible_chat",
            "subprocess_jsonl",
            "deterministic_stub"
          ]
        },
        "model_id": {
          "type": "string",
          "minLength": 1
        },
        "endpoint": {
          "type": "string"
        },
        "command": {
          "type": "array",
          "items": {
            "type": "string"
          },
          "minItems": 1
        },
        "parameters": {
          "type": "object"
        },
        "timeout_s": {
          "type": "number",
          "exclusiveMinimum": 0
        },
        "api_key_env": {
          "type": "string"
        },
        "seed_policy": {
          "enum": [
            "fixed",
            "paired_per_call"
          ]
        }
      }
    },
    "agent": {
      "type": "object",
      "additionalProperties": false,
      "required": [
        "system_prompt",
        "reasoning_policy"
      ],
      "properties": {
        "system_prompt": {
          "type": "string"
        },
        "reasoning_policy": {
          "type": "string"
        },
        "retrieval_top_k": {
          "type": "integer",
          "minimum": 1
        },
        "structured_top_k": {
          "type": "integer",
          "minimum": 1
        },
        "structured_salient_k": {
          "type": "integer",
          "minimum": 0
        },
        "parse_retries": {
          "type": "integer",
          "minimum": 0,
          "maximum": 3
        },
        "memory_char_limits": {
          "type": "object",
          "additionalProperties": false,
          "properties": {
            "B0": {
              "type": [
                "integer",
                "null"
              ],
              "minimum": 1
            },
            "B1": {
              "type": [
                "integer",
                "null"
              ],
              "minimum": 1
            },
            "B2": {
              "type": [
                "integer",
                "null"
              ],
              "minimum": 1
            },
            "B3": {
              "type": [
                "integer",
                "null"
              ],
              "minimum": 1
            }
          }
        },
        "observe_decisions": {
          "type": "boolean"
        },
        "maintenance_decisions": {
          "type": "boolean"
        },
        "observe_decision_types": {
          "type": [
            "array",
            "null"
          ],
          "items": {
            "type": "string",
            "minLength": 1
          },
          "uniqueItems": true
        }
      }
    },
    "calibration": {
      "type": "object",
      "additionalProperties": true,
      "required": [
        "instance_seeds",
        "repetitions",
        "bootstrap_resamples"
      ],
      "properties": {
        "instance_seeds": {
          "type": "array",
          "items": {
            "type": [
              "integer",
              "string"
            ]
          },
          "minItems": 1
        },
        "repetitions": {
          "type": "integer",
          "minimum": 1
        },
        "bootstrap_resamples": {
          "type": "integer",
          "minimum": 1
        },
        "bootstrap_seed": {
          "type": [
            "integer",
            "string"
          ]
        },
        "causal_baseline": {
          "const": "B3"
        },
        "causal_instance_seeds": {
          "type": "array",
          "items": {
            "type": [
              "integer",
              "string"
            ]
          },
          "minItems": 1
        },
        "causal_repetitions": {
          "type": "integer",
          "minimum": 1
        },
        "thresholds": {
          "type": "object",
          "additionalProperties": {
            "type": "number"
          }
        },
        "transfer_diagnostics": {
          "type": "object",
          "additionalProperties": false,
          "description": "Optional transfer diagnostic cells (M6.2). Supplemental: they never enter a calibration gate or the release-eligibility decision. Enabling them binds the cell set, epsilon, routing policy, and the oracle artifact bundle digest into the Experiment Lock.",
          "properties": {
            "enabled": {
              "type": "boolean",
              "default": false
            },
            "cells": {
              "type": "array",
              "uniqueItems": true,
              "items": {
                "type": "string",
                "enum": [
                  "B",
                  "AO",
                  "OA",
                  "OO"
                ]
              },
              "description": "AO requires a decomposable Memory Adapter, which the Same-Model Agent does not expose."
            },
            "epsilon": {
              "type": "number",
              "exclusiveMinimum": 0,
              "maximum": 1
            },
            "instance_seeds": {
              "type": "array",
              "minItems": 1,
              "items": {
                "type": [
                  "integer",
                  "string"
                ]
              }
            },
            "repetitions": {
              "type": "integer",
              "minimum": 1
            },
            "bootstrap_resamples": {
              "type": "integer",
              "minimum": 0
            }
          }
        },
        "additional_baselines": {
          "type": "object",
          "additionalProperties": false,
          "properties": {
            "recent_window": {
              "type": "integer",
              "minimum": 1
            },
            "oracle_reference": {
              "type": "boolean"
            },
            "max_memory_chars": {
              "type": "integer",
              "minimum": 1
            },
            "unbounded_reference": {
              "type": "boolean",
              "description": "Run B1 without a budget as the complete-history reference; required when B1 is bounded."
            }
          }
        },
        "purpose": {
          "enum": [
            "smoke",
            "pilot",
            "full"
          ]
        },
        "min_memory_pressure": {
          "type": "number",
          "minimum": 0
        }
      }
    }
  },
  "allOf": [
    {
      "if": {
        "properties": {
          "model": {
            "properties": {
              "client": {
                "enum": [
                  "http_json",
                  "openai_compatible_chat"
                ]
              }
            }
          }
        }
      },
      "then": {
        "properties": {
          "model": {
            "required": [
              "endpoint"
            ]
          }
        }
      }
    },
    {
      "if": {
        "properties": {
          "model": {
            "properties": {
              "client": {
                "const": "subprocess_jsonl"
              }
            }
          }
        }
      },
      "then": {
        "properties": {
          "model": {
            "required": [
              "command"
            ]
          }
        }
      }
    }
  ]
}
